{
  "schemaVersion": 1,
  "lessonId": "M01-L001",
  "generatedAt": "2026-03-11T04:49:20.261Z",
  "sourceScript": "M01-L001-script-master.json",
  "items": [
    {
      "id": "v-c9337e2739-thai-to-english",
      "vocabId": "v-c9337e2739",
      "type": "thai_to_english",
      "displayMode": "thai_only",
      "prompt": {
        "text": "What is the best meaning of สวัสดี?",
        "thai": "สวัสดี",
        "translit": "sà-wàt-dii"
      },
      "options": [
        "hello",
        "hello (male speaker)",
        "hello (female speaker)",
        "thank you"
      ],
      "answer": "hello",
      "rationale": "Maps Thai form to target meaning from script languageFocus."
    },
    {
      "id": "v-c9337e2739-english-to-thai",
      "vocabId": "v-c9337e2739",
      "type": "english_to_thai",
      "displayMode": "english_only",
      "prompt": {
        "text": "Select Thai for: hello",
        "english": "hello"
      },
      "options": [
        "สวัสดี",
        "สวัสดีครับ",
        "สวัสดีค่ะ",
        "ขอบคุณ"
      ],
      "answer": "สวัสดี",
      "rationale": "Reverses mapping for active recall."
    },
    {
      "id": "v-c9337e2739-fill-translit",
      "vocabId": "v-c9337e2739",
      "type": "fill_translit",
      "displayMode": "thai_only",
      "prompt": {
        "text": "Type the PTM transliteration for สวัสดี.",
        "thai": "สวัสดี"
      },
      "answer": "sà-wàt-dii",
      "rationale": "Forces transliteration production with inline tone marks."
    },
    {
      "id": "v-c9337e2739-context-mcq",
      "vocabId": "v-c9337e2739",
      "type": "context_mcq",
      "displayMode": "triplet",
      "prompt": {
        "text": "Choose the sentence that keeps the lesson meaning of this phrase.",
        "thai": "สวัสดี",
        "translit": "sà-wàt-dii",
        "english": "hello"
      },
      "options": [
        "Use สวัสดี in polite beginner conversation",
        "Use สวัสดีครับ in polite beginner conversation",
        "Use สวัสดีค่ะ in polite beginner conversation",
        "Use ขอบคุณ in polite beginner conversation"
      ],
      "answer": "Use สวัสดี in polite beginner conversation",
      "rationale": "Checks contextual understanding while preserving triplet exposure."
    },
    {
      "id": "v-e653eb5319-thai-to-english",
      "vocabId": "v-e653eb5319",
      "type": "thai_to_english",
      "displayMode": "thai_only",
      "prompt": {
        "text": "What is the best meaning of สวัสดีครับ?",
        "thai": "สวัสดีครับ",
        "translit": "sà-wàt-dii khráp"
      },
      "options": [
        "hello (male speaker)",
        "hello",
        "hello (female speaker)",
        "thank you"
      ],
      "answer": "hello (male speaker)",
      "rationale": "Maps Thai form to target meaning from script languageFocus."
    },
    {
      "id": "v-e653eb5319-english-to-thai",
      "vocabId": "v-e653eb5319",
      "type": "english_to_thai",
      "displayMode": "english_only",
      "prompt": {
        "text": "Select Thai for: hello (male speaker)",
        "english": "hello (male speaker)"
      },
      "options": [
        "สวัสดีครับ",
        "สวัสดี",
        "สวัสดีค่ะ",
        "ขอบคุณ"
      ],
      "answer": "สวัสดีครับ",
      "rationale": "Reverses mapping for active recall."
    },
    {
      "id": "v-e653eb5319-fill-translit",
      "vocabId": "v-e653eb5319",
      "type": "fill_translit",
      "displayMode": "thai_only",
      "prompt": {
        "text": "Type the PTM transliteration for สวัสดีครับ.",
        "thai": "สวัสดีครับ"
      },
      "answer": "sà-wàt-dii khráp",
      "rationale": "Forces transliteration production with inline tone marks."
    },
    {
      "id": "v-e653eb5319-context-mcq",
      "vocabId": "v-e653eb5319",
      "type": "context_mcq",
      "displayMode": "triplet",
      "prompt": {
        "text": "Choose the sentence that keeps the lesson meaning of this phrase.",
        "thai": "สวัสดีครับ",
        "translit": "sà-wàt-dii khráp",
        "english": "hello (male speaker)"
      },
      "options": [
        "Use สวัสดีครับ in polite beginner conversation",
        "Use สวัสดี in polite beginner conversation",
        "Use สวัสดีค่ะ in polite beginner conversation",
        "Use ขอบคุณ in polite beginner conversation"
      ],
      "answer": "Use สวัสดีครับ in polite beginner conversation",
      "rationale": "Checks contextual understanding while preserving triplet exposure."
    },
    {
      "id": "v-bccbe506b3-thai-to-english",
      "vocabId": "v-bccbe506b3",
      "type": "thai_to_english",
      "displayMode": "thai_only",
      "prompt": {
        "text": "What is the best meaning of สวัสดีค่ะ?",
        "thai": "สวัสดีค่ะ",
        "translit": "sà-wàt-dii khâ"
      },
      "options": [
        "hello (female speaker)",
        "hello",
        "hello (male speaker)",
        "thank you"
      ],
      "answer": "hello (female speaker)",
      "rationale": "Maps Thai form to target meaning from script languageFocus."
    },
    {
      "id": "v-bccbe506b3-english-to-thai",
      "vocabId": "v-bccbe506b3",
      "type": "english_to_thai",
      "displayMode": "english_only",
      "prompt": {
        "text": "Select Thai for: hello (female speaker)",
        "english": "hello (female speaker)"
      },
      "options": [
        "สวัสดีค่ะ",
        "สวัสดี",
        "สวัสดีครับ",
        "ขอบคุณ"
      ],
      "answer": "สวัสดีค่ะ",
      "rationale": "Reverses mapping for active recall."
    },
    {
      "id": "v-bccbe506b3-fill-translit",
      "vocabId": "v-bccbe506b3",
      "type": "fill_translit",
      "displayMode": "thai_only",
      "prompt": {
        "text": "Type the PTM transliteration for สวัสดีค่ะ.",
        "thai": "สวัสดีค่ะ"
      },
      "answer": "sà-wàt-dii khâ",
      "rationale": "Forces transliteration production with inline tone marks."
    },
    {
      "id": "v-bccbe506b3-context-mcq",
      "vocabId": "v-bccbe506b3",
      "type": "context_mcq",
      "displayMode": "triplet",
      "prompt": {
        "text": "Choose the sentence that keeps the lesson meaning of this phrase.",
        "thai": "สวัสดีค่ะ",
        "translit": "sà-wàt-dii khâ",
        "english": "hello (female speaker)"
      },
      "options": [
        "Use สวัสดีค่ะ in polite beginner conversation",
        "Use สวัสดี in polite beginner conversation",
        "Use สวัสดีครับ in polite beginner conversation",
        "Use ขอบคุณ in polite beginner conversation"
      ],
      "answer": "Use สวัสดีค่ะ in polite beginner conversation",
      "rationale": "Checks contextual understanding while preserving triplet exposure."
    },
    {
      "id": "v-217b46aa5a-thai-to-english",
      "vocabId": "v-217b46aa5a",
      "type": "thai_to_english",
      "displayMode": "thai_only",
      "prompt": {
        "text": "What is the best meaning of ขอบคุณ?",
        "thai": "ขอบคุณ",
        "translit": "khàawp-khun"
      },
      "options": [
        "thank you",
        "hello",
        "hello (male speaker)",
        "hello (female speaker)"
      ],
      "answer": "thank you",
      "rationale": "Maps Thai form to target meaning from script languageFocus."
    },
    {
      "id": "v-217b46aa5a-english-to-thai",
      "vocabId": "v-217b46aa5a",
      "type": "english_to_thai",
      "displayMode": "english_only",
      "prompt": {
        "text": "Select Thai for: thank you",
        "english": "thank you"
      },
      "options": [
        "ขอบคุณ",
        "สวัสดี",
        "สวัสดีครับ",
        "สวัสดีค่ะ"
      ],
      "answer": "ขอบคุณ",
      "rationale": "Reverses mapping for active recall."
    },
    {
      "id": "v-217b46aa5a-fill-translit",
      "vocabId": "v-217b46aa5a",
      "type": "fill_translit",
      "displayMode": "thai_only",
      "prompt": {
        "text": "Type the PTM transliteration for ขอบคุณ.",
        "thai": "ขอบคุณ"
      },
      "answer": "khàawp-khun",
      "rationale": "Forces transliteration production with inline tone marks."
    },
    {
      "id": "v-217b46aa5a-context-mcq",
      "vocabId": "v-217b46aa5a",
      "type": "context_mcq",
      "displayMode": "triplet",
      "prompt": {
        "text": "Choose the sentence that keeps the lesson meaning of this phrase.",
        "thai": "ขอบคุณ",
        "translit": "khàawp-khun",
        "english": "thank you"
      },
      "options": [
        "Use ขอบคุณ in polite beginner conversation",
        "Use สวัสดี in polite beginner conversation",
        "Use สวัสดีครับ in polite beginner conversation",
        "Use สวัสดีค่ะ in polite beginner conversation"
      ],
      "answer": "Use ขอบคุณ in polite beginner conversation",
      "rationale": "Checks contextual understanding while preserving triplet exposure."
    },
    {
      "id": "v-6fce5e8c2c-thai-to-english",
      "vocabId": "v-6fce5e8c2c",
      "type": "thai_to_english",
      "displayMode": "thai_only",
      "prompt": {
        "text": "What is the best meaning of ขอโทษ?",
        "thai": "ขอโทษ",
        "translit": "khǎaw-thôot"
      },
      "options": [
        "excuse me / sorry",
        "hello",
        "hello (male speaker)",
        "hello (female speaker)"
      ],
      "answer": "excuse me / sorry",
      "rationale": "Maps Thai form to target meaning from script languageFocus."
    },
    {
      "id": "v-6fce5e8c2c-english-to-thai",
      "vocabId": "v-6fce5e8c2c",
      "type": "english_to_thai",
      "displayMode": "english_only",
      "prompt": {
        "text": "Select Thai for: excuse me / sorry",
        "english": "excuse me / sorry"
      },
      "options": [
        "ขอโทษ",
        "สวัสดี",
        "สวัสดีครับ",
        "สวัสดีค่ะ"
      ],
      "answer": "ขอโทษ",
      "rationale": "Reverses mapping for active recall."
    },
    {
      "id": "v-6fce5e8c2c-fill-translit",
      "vocabId": "v-6fce5e8c2c",
      "type": "fill_translit",
      "displayMode": "thai_only",
      "prompt": {